,created_at,text,lang,timestamp_ms,preprocessed,lemma stop
4,Mon Nov 01 03:20:34 +0000 2021,@mishacollins @vic_righthand I’m contacting my law team,en,1635736834658, i m contacting my law team,contact law team
5,Mon Nov 01 03:20:48 +0000 2021,@mishacollins @vic_righthand uh. i mean. lookin’ good. ☺️👍🏻,en,1635736848665, uh i mean lookin good ,uh mean lookin good
6,Mon Nov 01 03:23:05 +0000 2021,@mishacollins @vic_righthand bro me,en,1635736985666, bro me,bro
8,Mon Nov 01 03:27:47 +0000 2021,"@Tori658 @FaceMcnerd @mishacollins @vic_righthand Nope, my eye went immediately to it, even on the ""wrong"" arm.😳😲",en,1635737267657, nope my eye went immediately to it even on the wrong arm ,nope eye go immediately even wrong arm
11,Mon Nov 01 03:46:13 +0000 2021,@proCasDeanating @mishacollins @vic_righthand PLEASE,en,1635738373663, please,please
12,Mon Nov 01 03:50:05 +0000 2021,@mishacollins @vic_righthand You got a little something on your face lol,en,1635738605657, you got a little something on your face lol,get little something face lol
15,Mon Nov 01 04:06:16 +0000 2021,@mishacollins @vic_righthand Damn! You still look hot as hell as a zombie! 🤩😍,en,1635739576661, damn you still look hot as hell as a zombie ,damn still look hot hell zombie
16,Mon Nov 01 04:07:57 +0000 2021,"Life is always going to keep coming at you from all directions. These are good reminders, and poems such as ‘Downpour’ are spot on. Thank you for your words @mishacollins . It’s nice not to feel alone or hopeless. #SomeThingsIStillCantTellYou https://t.co/JYNV3VGEEC https://t.co/wOXT5KxfEh",en,1635739677666,life is always going to keep coming at you from all directions these are good reminders and poems such as downpour are spot on thank you for your words it s nice not to feel alone or hopeless ,life always go keep come directions good reminders poems downpour spot thank word nice feel alone hopeless
17,Mon Nov 01 06:34:39 +0000 2021,@CasGirl_Sheha @mishacollins @strandbookstore yayy you got your book! Also cute meow meow.,en,1635748479665, yayy you got your book also cute meow meow ,yayy get book also cute meow meow
21,Mon Nov 01 11:04:27 +0000 2021,"Enjoy the Momento Con 2021 Misha Collins Q&amp;A Panel recorded on Saturday, 9/4/21, at the David Lawrence Convention Center in Pittsburgh, PA. @mishacollins 

Find out more about our upcoming events here: 
https://t.co/i3wbDbHpXW

https://t.co/5DROZP0Vrm",en,1635764667663,enjoy the momento con 2021 misha collins q amp a panel recorded on saturday 9 4 21 at the david lawrence convention center in pittsburgh pa find out more about our upcoming events here ,enjoy momento con 2021 misha collins q amp panel record saturday 9 4 21 david lawrence convention center pittsburgh pa find upcoming events
22,Mon Nov 01 11:29:16 +0000 2021,"@mishacollins @vic_righthand Excuse me sir, you got a little ketchup on you…😜🎃",en,1635766156659, excuse me sir you got a little ketchup on you ,excuse sir get little ketchup
28,Mon Nov 01 17:49:32 +0000 2021,@magikandmayhem_ @the_endverse @cptnmidnite @mishacollins @vic_righthand That's Phil?????? 😯😯😯,en,1635788972661, that s phil ,phil
30,Mon Nov 01 20:06:36 +0000 2021,@mishacollins #SomeThingsIStillCantTellYou book is so good that Emma won’t Part with it even while sleeping . Good thing I have another one all for myself . So we both can cuddle into warm blankets and read on a cold November nicht . Get yours here : https://t.co/wTpBw2TjqQ https://t.co/MN0SIrawNq,en,1635797196666, book is so good that emma won t part with it even while sleeping good thing i have another one all for myself so we both can cuddle into warm blankets and read on a cold november nicht get yours here ,book good emma part even sleep good thing another one cuddle warm blanket read cold november nicht get
32,Mon Nov 01 20:41:04 +0000 2021,There's something about Misha Collins running that I find very entertaining,en,1635799264660,there s something about misha collins running that i find very entertaining,something misha collins run find entertain
34,Mon Nov 01 21:00:00 +0000 2021,"Ep.286 — 13:22 — ""Exodus""

humans: not perfect 
hardwired to fall and then 
they need a fall guy

@MarkRPellegrino @Alex8Calvert @mishacollins",en,1635800400663,ep 286 13 22 exodus humans not perfect hardwired to fall and then they need a fall guy ,ep 286 13 22 exodus humans perfect hardwired fall need fall guy
40,Mon Nov 01 23:42:14 +0000 2021,"Signed book to Indonesia!!

I feel like hugged not only by @mishacollins but many others. Thankyou so much for @updatesmisha @ewlyn give chance to people with programs and help us so we could get this beautiful book #SomeThingsIStillCantTellYou 

Get it: https://t.co/g0nJJbCiV4 https://t.co/iqcYBtpej8",en,1635810134663,signed book to indonesia i feel like hugged not only by but many others thankyou so much for give chance to people with programs and help us so we could get this beautiful book get it ,sign book indonesia feel like hug many others thankyou much give chance people program help us could get beautiful book get
41,Tue Nov 02 00:53:54 +0000 2021,"Next is @hollidewees
We lost this bright light this year.
I was fortunate to meet her through supernatural in line for @mishacollins and @OsricChau stood in line with us.
I will forever be grateful for the photo she took for me that day.
I send her family love. https://t.co/gj7ibDOIzy",en,1635814434664,next is we lost this bright light this year i was fortunate to meet her through supernatural in line for and stood in line with us i will forever be grateful for the photo she took for me that day i send her family love ,next lose bright light year fortunate meet supernatural line stand line us forever grateful photo take day send family love
43,Tue Nov 02 01:54:26 +0000 2021,"@GISHBOT @mishacollins @charliecapen So whatcha say @GISH HQ , and @mishacollins and @charliecapen  ?
Can you loan out @GISHBOT for our #mishamesses? I hear he’s making and appearance @Stands  anyways…",en,1635818066665, so whatcha say hq and and can you loan out for our i hear he s making and appearance anyways ,whatcha say hq loan hear make appearance anyways
44,Tue Nov 02 05:15:31 +0000 2021,@mishacollins This is brilliant. Thank you. https://t.co/RbPjlkUnXU,en,1635830131665, this is brilliant thank you ,brilliant thank
47,Tue Nov 02 17:01:31 +0000 2021,@TammyPacyna @SuperWiki @mishacollins My parents live not too far from Colarussos. Trying to drive past the one in Avoca on a Friday is a nightmare! The street is always jammed. Their pizza is so delicious. I could eat it all the time.,en,1635872491663, my parents live not too far from colarussos trying to drive past the one in avoca on a friday is a nightmare the street is always jammed their pizza is so delicious i could eat it all the time ,parent live far colarussos try drive past one avoca friday nightmare street always jam pizza delicious could eat time
58,Wed Nov 03 04:38:36 +0000 2021,@Dyllion17 @JensenAckles @jarpad @mishacollins oh yeah they did lol im just hoping they give an actual story about the very first supernatural hunters 😂,en,1635914316666, oh yeah they did lol im just hoping they give an actual story about the very first supernatural hunters ,oh yeah lol im hop give actual story first supernatural hunters
59,Wed Nov 03 11:39:47 +0000 2021,@kirky_simone @iz_jules @_KingBooks_ @mishacollins The pics are beautiful 🥰🥰. I ignore the negative and block the bad ones. Hope you are both okey 🥰. I have ordered mishas book but its not being delivered till January in the uk 😭😭,en,1635939587663, the pics are beautiful i ignore the negative and block the bad ones hope you are both okey i have ordered mishas book but its not being delivered till january in the uk ,pics beautiful ignore negative block bad ones hope okey order mishas book deliver till january uk
60,Wed Nov 03 15:43:42 +0000 2021,@DimitriTheSimp @mishacollins @MrJakeAbel @sebroche @RuthieConnell @RobBenedict @Mark_Sheppard @feliciaday Start by joining an extras agency to see if it's something you really want to do. I did that! I ended up not wanting to go into acting BUT it was good to be on film and TV sets and I'm still on the books to do extras work.,en,1635954222664, start by joining an extras agency to see if it s something you really want to do i did that i ended up not wanting to go into acting but it was good to be on film and tv sets and i m still on the books to do extras work ,start join extras agency see something really want end want go act good film tv set still book extras work
61,Wed Nov 03 20:24:40 +0000 2021,@AmandaWalters00 @mishacollins What were these for? A Con?,en,1635971080665, what were these for a con ,con
65,Thu Nov 04 10:28:40 +0000 2021,please misha collins if you wouldnt mind being absolutely insane on twitter tommorow it would make my day https://t.co/ZRbVowqs95,en,1636021720661,please misha collins if you wouldnt mind being absolutely insane on twitter tommorow it would make my day ,please misha collins wouldnt mind absolutely insane twitter tommorow would make day
67,Thu Nov 04 10:41:44 +0000 2021,@TheLadyStarfyre @mishacollins Me too! 😱💗💗💗 https://t.co/tW0fFQFV8B,en,1636022504659, me too ,
68,Thu Nov 04 13:59:34 +0000 2021,@JensenAckles @mishacollins @DanneelHarris @GenPadalecki @jarpad @jumblejim how can I get you and your families to my wedding? 9-17-22. Central iowa,en,1636034374661, how can i get you and your families to my wedding 9 17 22 central iowa,get families wed 9 17 22 central iowa
69,Thu Nov 04 21:16:20 +0000 2021,@LicieOIC @mishacollins I love rainbow wings. 🥺🥺🥺🥺🥺🥺🥺🥺,en,1636060580660, i love rainbow wings ,love rainbow wing
73,Thu Nov 04 22:11:39 +0000 2021,@mishacollins LIKED THIS??? MISHA??? TUMBLR?? EXPLAIN?? IM SCARED???,en,1636063899662, liked this misha tumblr explain im scared ,like misha tumblr explain im scar
74,Thu Nov 04 22:28:41 +0000 2021,"@tumblr @HONEYBEECASTlEL @irvnstark @beesarecute02 @mishacollins I mean you made O3 happen for us, thx bestie.",en,1636064921663, i mean you made o3 happen for us thx bestie ,mean make o3 happen us thx bestie
77,Thu Nov 04 22:56:30 +0000 2021,@tumblr @mishacollins why oat milk what are you trying to say,en,1636066590658, why oat milk what are you trying to say,oat milk try say
80,Thu Nov 04 23:28:56 +0000 2021,@DebbieB18026946 @vuichard_kellie @LifeofNana @mishacollins @JCMaine1 @TheRoseRichards @CasIsLoved @allyjay666 @GISH Love ya 😘😘,en,1636068536663, love ya ,love ya
82,Thu Nov 04 23:42:45 +0000 2021,"@tumblr @mishacollins 🍪🥛🍪🥛🍪🥛🍪🥛🍪🥛🍪🥛
💗😎💗😇💗😎💗😇💗😎💗😇
Prepping for the big day. I swear this is bigger than C.mas 4 me..!",en,1636069365658, prepping for the big day i swear this is bigger than c mas 4 me ,prepping big day swear bigger c mas 4
86,Fri Nov 05 00:54:33 +0000 2021,@SlusanSusan @tumblr @mishacollins cope.,en,1636073673663, cope ,cope
87,Fri Nov 05 01:27:50 +0000 2021,@tumblr @mishacollins @tumblr why would you promote a post like this where the op is censoring the main actor's name?,en,1636075670666, why would you promote a post like this where the op is censoring the main actor s name ,would promote post like op censor main actor name
95,Fri Nov 05 06:29:56 +0000 2021,"""I love lamp.""
Disobedience 
#Destiel #DestielAnniversary #Supernatural #mishacollins #JensenAckles https://t.co/HNy7iHBq30",en,1636093796662, i love lamp disobedience ,love lamp disobedience
96,Fri Nov 05 07:09:31 +0000 2021,@Lish1381 @mishacollins Fan of your boyfriend now🤣,en,1636096171662, fan of your boyfriend now ,fan boyfriend
105,Fri Nov 05 12:39:32 +0000 2021,"And today I turn the big 4-0
Any birthday love from some of my absolute favorite folks in the twitterverse?
@TineMarieRiis @SaraMoniCosplay @mishacollins @straczynski @NathanFillion @VonMiller @thekidmcmanus @AniMiaOfficial @AlanTudyk @JewelStaite",en,1636115972666,and today i turn the big 4 0 any birthday love from some of my absolute favorite folks in the twitterverse ,today turn big 4 0 birthday love absolute favorite folks twitterverse
110,Fri Nov 05 17:06:53 +0000 2021,"A year ago, my eyes were rivers in flood..
I had never cried like this for a ""character"", the one and only @mishacollins could make it possible, because Castiel for us wasn't just a character, HE made it REAL! 

#castiel #CastielForever https://t.co/buPBg0jOCs",en,1636132013663,a year ago my eyes were rivers in flood i had never cried like this for a character the one and only could make it possible because castiel for us wasn t just a character he made it real ,year ago eye rivers flood never cry like character one could make possible castiel us character make real
111,Fri Nov 05 17:50:04 +0000 2021,"Oh hell yeah ❤️ 
#DestielAnniversary 
#DeanCasAnniversary #deancas #Castiel #Dean @mishacollins @JensenAckles",en,1636134604663,oh hell yeah ,oh hell yeah
112,Fri Nov 05 18:10:38 +0000 2021,@GranuailleLing @mishacollins the betrayed look he gave us when we did what he requested was priceless,en,1636135838666, the betrayed look he gave us when we did what he requested was priceless,betray look give us request priceless
122,Fri Nov 05 23:32:20 +0000 2021,"I just moved, and I’m pretty excited about it my Supernatural wall!Especially since some of it isn’t even Supernatural by nature I just found them and they fit so well I couldn’t resist! “All the Pies”, “Don’t Wake the Bear”, and Musical Angel Wings! @mishacollins @JensenAckles https://t.co/13DhAAayGd",en,1636155140660,i just moved and i m pretty excited about it my supernatural wall especially since some of it isn t even supernatural by nature i just found them and they fit so well i couldn t resist all the pies don t wake the bear and musical angel wings ,move pretty excite supernatural wall especially since even supernatural nature find fit well resist pies wake bear musical angel wing
124,Sat Nov 06 03:52:23 +0000 2021,@SDeeg13 @peakbaio @Lish1381 @eldestdaughterr @casdeanhell @bbntrenchcoat @jennmpotter @mishacollins Oh Susan 😭😭 sending you hugs babes!,en,1636170743662, oh susan sending you hugs babes ,oh susan send hug babes
132,Sat Nov 06 16:32:00 +0000 2021,"Why can't we have this every convention?

#SPNDenver 
#mishacollins
#JensenAckles https://t.co/aHJOlb2HkZ",en,1636216320666,why can t we have this every convention ,every convention
134,Sat Nov 06 18:57:33 +0000 2021,@mishacollins I’m a translator who helps people from CIS countries to be on your panels even remotely. Thank you for everything. You’re my number one. I SWEAR. https://t.co/G1lsa4pxe9,en,1636225053659, i m a translator who helps people from cis countries to be on your panels even remotely thank you for everything you re my number one i swear ,translator help people cis countries panel even remotely thank everything number one swear
139,Sat Nov 06 20:20:00 +0000 2021,"Ep.289 — 14:2 — ""Gods and Monsters""

you were in a lot 
of pain, and Lucifer saw 
and exploited it

@MarkRPellegrino @mishacollins",en,1636230000657,ep 289 14 2 gods and monsters you were in a lot of pain and lucifer saw and exploited it ,ep 289 14 2 gods monsters lot pain lucifer saw exploit
142,Sat Nov 06 21:44:35 +0000 2021,"My order of ""some things I still cant tell you"" was cancelled😭 (I preordered it as soon as it was possible) I just wanna read it like the rest of the people 💕 You can't buy it in Germany 🥺 @mishacollins",en,1636235075663,my order of some things i still cant tell you was cancelled i preordered it as soon as it was possible i just wanna read it like the rest of the people you can t buy it in germany ,order things still cant tell cancel preordered soon possible wanna read like rest people buy germany
155,Sun Nov 07 10:30:48 +0000 2021,@AcklesFanClub @JensenAckles @mishacollins @cas_wants_a_cat @CASDEANISM @CasDeanMyHeaven @casiferswings @casinthemeadow @Casllins @bestjenmish the pockets are different but still - misha is clearly dean-coded. 😂,en,1636281048665, the pockets are different but still misha is clearly dean coded ,pocket different still misha clearly dean cod
159,Sun Nov 07 15:39:10 +0000 2021,"So, like, we're all in agreement that Misha Collins &amp; Oliver Stark should meet and cause chaos together, right?",en,1636299550658,so like we re all in agreement that misha collins amp oliver stark should meet and cause chaos together right ,like agreement misha collins amp oliver stark meet cause chaos together right
162,Sun Nov 07 17:36:08 +0000 2021,@Iovelyackles @mishacollins His smile. And the way he’s looking at you. I’m weak. How did you stay coherent? This is amongst my favorite ops! Thanks for sharing with us ❤️,en,1636306568658, his smile and the way he s looking at you i m weak how did you stay coherent this is amongst my favorite ops thanks for sharing with us ,smile way look weak stay coherent amongst favorite ops thank share us
163,Sun Nov 07 18:42:57 +0000 2021,"@MariaSantocono @jules_laufeyson I know he said he stopped reading comments because he was very depressed when he saw some hating ones. But he checks the ""misha collins"" mentions every once in a while, so he could see that nasty tweet. I hope he doesn't.",en,1636310577661, i know he said he stopped reading comments because he was very depressed when he saw some hating ones but he checks the misha collins mentions every once in a while so he could see that nasty tweet i hope he doesn t ,know say stop read comment depress saw hat ones check misha collins mention every could see nasty tweet hope
165,Sun Nov 07 19:25:02 +0000 2021,"🤔Thinking in the future name for @mishacollins book, it could be 
From #SomeThingsIStillCantTellYou
To
#SomeThingsNowImGonnaTellYouYoureNotReadyYouBetterRun😅
Just kidding🙈 
Manifesting Volume 2 or new book soon🤞🤩🤞 https://t.co/MYxUpBnX4W",en,1636313102666, thinking in the future name for book it could be from to just kidding manifesting volume 2 or new book soon ,think future name book could kid manifest volume 2 new book soon
172,Mon Nov 08 03:54:11 +0000 2021,@mishackiwi @mishacollins Yeah so far there's only 2 individual copies in most of Southern Ontario. I hope more soon,en,1636343651663, yeah so far there s only 2 individual copies in most of southern ontario i hope more soon,yeah far 2 individual copy southern ontario hope soon
173,Mon Nov 08 04:08:10 +0000 2021,"@jennythefriend @autisticcastiel @Casnewvessel @patrocluscas @MILFSTIEL @wondersofprey @HONEYBEECASTlEL @fionaswhvre @girlboss_cas @bloodfreakish @FIREFLYCASTIEL @caskissr @mishacollins misha, reading all of this on his stan account: https://t.co/SvUNnvGSrG",en,1636344490657, misha reading all of this on his stan account ,misha read stan account
174,Mon Nov 08 06:14:11 +0000 2021,"Yesterday, I was fighting demons with Azazel while hunting the Ghostfacers and utilizing salt. Later, I broke the fourth wall, so Misha Collins and I went home.",en,1636352051659,yesterday i was fighting demons with azazel while hunting the ghostfacers and utilizing salt later i broke the fourth wall so misha collins and i went home ,yesterday fight demons azazel hunt ghostfacers utilize salt later break fourth wall misha collins go home
175,Mon Nov 08 16:44:20 +0000 2021,"@EkaGlzz @mishacollins Yesss, maybe he really is 🥺 I really hope so ❤️",en,1636389860657, yesss maybe he really is i really hope so ,yesss maybe really really hope
182,Mon Nov 08 21:38:17 +0000 2021,@mishacollins @PBS @Roadfood123 @GoldPeak @Ally This trailer has led me to the conclusion that I have made nothing but terrible decisions in my life. Why am I not getting paid to eat?,en,1636407497657, this trailer has led me to the conclusion that i have made nothing but terrible decisions in my life why am i not getting paid to eat ,trailer lead conclusion make nothing terrible decisions life get pay eat
183,Mon Nov 08 22:10:14 +0000 2021,"@zenxv @mishacollins … have intent to kill, that’s your logic. 🤷‍♀️",en,1636409414663, have intent to kill that s your logic ,intent kill logic
186,Mon Nov 08 23:49:07 +0000 2021,"@mishacollins @PBS @Roadfood123 @GoldPeak @Ally Me, making notes for the ultimate road trip. https://t.co/tKj4L6Pbef",en,1636415347665, me making notes for the ultimate road trip ,make note ultimate road trip
194,Tue Nov 09 02:41:33 +0000 2021,"@queenRobina @Roadfood123 @mishacollins Apparently for no one, as usual we are crashers 🙈",en,1636425693659, apparently for no one as usual we are crashers ,apparently one usual crashers
198,Tue Nov 09 07:17:46 +0000 2021,".@mishacollins, food &amp; road tripping across the states? My dream holiday!",en,1636442266658, food amp road tripping across the states my dream holiday ,food amp road trip across state dream holiday
203,Tue Nov 09 15:36:45 +0000 2021,"@mishacollins @PBS @Roadfood123 @GoldPeak @Ally @mishacollins Good luck to you, my sweet Cas😀
Dear Misha, you give me great pleasure and huge happiness with your heartfelt impressive incredibly emotional expressive play play. Thank you! ❤️
So, I'm looking forward to new culinary episodes and delicious recipes.",en,1636472205665, good luck to you my sweet cas dear misha you give me great pleasure and huge happiness with your heartfelt impressive incredibly emotional expressive play play thank you so i m looking forward to new culinary episodes and delicious recipes ,good luck sweet cas dear misha give great pleasure huge happiness heartfelt impressive incredibly emotional expressive play play thank look forward new culinary episodes delicious recipes
206,Tue Nov 09 18:29:27 +0000 2021,@mishacollins @therealKripke @Roadfood123 OMG. Cute❤,en,1636482567663, omg cute ,omg cute
213,Tue Nov 09 20:02:17 +0000 2021,It’s my birthday guys!!! Thank you @GISH and @mishacollins for making my day 10 times more amazing!! https://t.co/F3qBhyQhDp,en,1636488137662,it s my birthday guys thank you and for making my day 10 times more amazing ,birthday guy thank make day 10 time amaze
216,Tue Nov 09 20:40:36 +0000 2021,@castielfanboy @GISH @mishacollins happy birthday!,en,1636490436664, happy birthday ,happy birthday
221,Wed Nov 10 05:13:30 +0000 2021,@ortegolauren The colour of the sky post was always a treat bc u never know if it’s misha collins at the end or if it’s the original post,en,1636521210665, the colour of the sky post was always a treat bc u never know if it s misha collins at the end or if it s the original post,colour sky post always treat bc u never know misha collins end original post
229,Wed Nov 10 17:13:50 +0000 2021,@Nicole11605183 @Arosie143 @brittshea28 @SjSrwillis06 @GRITSSPNFAM1 @GF0911 @TXTransplant45 @suebsg9 @fredsfam @Angiebear333 @ManuelaEffrena @Castiels_bee_ @JensenAckles @jarpad @mishacollins Good morning beautiful ❤️,en,1636564430665, good morning beautiful ,good morning beautiful
234,Wed Nov 10 19:05:46 +0000 2021,#mishacollins I miss him all of him https://t.co/DdA5Z0qBW2,en,1636571146661, i miss him all of him ,miss
248,Thu Nov 11 23:07:34 +0000 2021,@bearbubb Misha Collins https://t.co/ufViIV39bn,en,1636672054663, misha collins ,misha collins
249,Fri Nov 12 01:41:39 +0000 2021,"@cw_spn S1E13 Route 666 Deans first love, Cassie. Deans last love, Cass. Coincidence??? I think not!!! Lol @jarpad @JensenAckles @mishacollins",en,1636681299659, s1e13 route 666 deans first love cassie deans last love cass coincidence i think not lol ,s1e13 route 666 deans first love cassie deans last love cass coincidence think lol
254,Fri Nov 12 13:38:09 +0000 2021,@TVGuide #Supernatural cast interviews and outtakes 11/9/2020 @jarpad @JensenAckles @mishacollins @Alex8Calvert https://t.co/HBSRlcD6QR,en,1636724289666, cast interviews and outtakes 11 9 2020 ,cast interview outtakes 11 9 2020
255,Fri Nov 12 13:47:00 +0000 2021,@MionaShulesLove @mishacollins @dicksp8jr @RachelMiner1 @Omundson so happy to see this. oh my god.,en,1636724820657, so happy to see this oh my god ,happy see oh god
256,Fri Nov 12 14:01:22 +0000 2021,"@mishacollins,thank you for being so graciously engaged with all of us lately. VERY cool.I feel honored to support you and help better this world in any small way possible with this incredible family. #SomeThingsIStillCantTellYou https://t.co/JYNV3VGEEC @Roadfood123 #WhereIsMisha https://t.co/XZ2BcaNCKv",en,1636725682660, thank you for being so graciously engaged with all of us lately very cool i feel honored to support you and help better this world in any small way possible with this incredible family ,thank graciously engage us lately cool feel honor support help better world small way possible incredible family
258,Fri Nov 12 17:19:10 +0000 2021,Friendly reminder that this picture of Misha Collins exists ❤️ https://t.co/ucNJDIsjjp,en,1636737550665,friendly reminder that this picture of misha collins exists ,friendly reminder picture misha collins exist
259,Fri Nov 12 17:46:02 +0000 2021,@heyDe__ @elegnome @Roadfood123 @mishacollins @PBS Don’t stop but share your talents,en,1636739162657, don t stop but share your talents,stop share talents
262,Fri Nov 12 20:55:43 +0000 2021,"Please retweet, lets make this crash the internet
https://t.co/XTnUVg5bBG

#AGift4Misha
@mishacollins",en,1636750543664,please retweet lets make this crash the internet ,please retweet let make crash internet
263,Fri Nov 12 20:58:00 +0000 2021,Exactly! #agift4misha #globalloveattack @mishacollins,en,1636750680661,exactly ,exactly
264,Fri Nov 12 21:41:09 +0000 2021,"What is this? It's a #globalloveattack
And who are we? We are the #armyOfLove of #agift4misha

Take a look @mishacollins
https://t.co/icohA3kCca",en,1636753269658,what is this it s a and who are we we are the of take a look ,take look
