,created_at,text,lang,timestamp_ms,preprocessed,lemma stop
3950,Tue Apr 26 02:42:54 +0000 2022,@p0rkyTV @mishacollins do i think he should be cancelled over this? no. do i hate him for it? he obviously doesn’t deserve all the hate for this but people are still allowed to be upset.,en,1650940974662, do i think he should be cancelled over this no do i hate him for it he obviously doesn t deserve all the hate for this but people are still allowed to be upset ,think cancel hate obviously deserve hate people still allow upset
3961,Tue Apr 26 02:56:56 +0000 2022,i tried to take a break from twitter i really did but then i heard two teenagers talking about misha collins coming out as straight and i just couldn’t stay away,en,1650941816662,i tried to take a break from twitter i really did but then i heard two teenagers talking about misha collins coming out as straight and i just couldn t stay away,try take break twitter really hear two teenagers talk misha collins come straight stay away
3964,Tue Apr 26 03:17:34 +0000 2022,im just like misha collins because ive also accidentally came out as bi,en,1650943054658,im just like misha collins because ive also accidentally came out as bi,im like misha collins ive also accidentally come bi
3965,Tue Apr 26 03:17:49 +0000 2022,so when is misha collins gonna once again come out as bi but this time in a tweet written entirely in spanish,en,1650943069664,so when is misha collins gonna once again come out as bi but this time in a tweet written entirely in spanish,misha collins gonna come bi time tweet write entirely spanish
3970,Tue Apr 26 03:26:24 +0000 2022,"@p0rkyTV @greybunnix @mishacollins She explained she made a mistake and you are still harping on her. Meanwhile blue check says ""oh I made a mistake I am not bisexual, gosh how did I ever think that and not just say it for likes?"" And you were fine with it....😳🤣🤣",en,1650943584663, she explained she made a mistake and you are still harping on her meanwhile blue check says oh i made a mistake i am not bisexual gosh how did i ever think that and not just say it for likes and you were fine with it ,explain make mistake still harp meanwhile blue check say oh make mistake bisexual gosh ever think say like fine
3972,Tue Apr 26 03:30:15 +0000 2022,@mishacollins this is so funny i thought u were out as pan since like 2015,en,1650943815665, this is so funny i thought u were out as pan since like 2015,funny think u pan since like 2015
3974,Tue Apr 26 03:31:58 +0000 2022,@buggin88 @greybunnix @mishacollins Did you read his tweets or are tou Conning?,en,1650943918662, did you read his tweets or are tou conning ,read tweet tou con
3975,Tue Apr 26 03:37:01 +0000 2022,misha collins coming out as straight is so fucking funny because weren’t y’all JUST saying  “i KNEW he was bi”  a couple hours ago ?    /lh,en,1650944221659,misha collins coming out as straight is so fucking funny because weren t y all just saying i knew he was bi a couple hours ago lh,misha collins come straight fuck funny say know bi couple hours ago lh
3976,Tue Apr 26 03:38:06 +0000 2022,"In light of recent Misha Collins news, I offer a meme 🤲 https://t.co/sKjZGvA4zW",en,1650944286663,in light of recent misha collins news i offer a meme ,light recent misha collins news offer meme
3980,Tue Apr 26 03:43:28 +0000 2022,"i never even knew misha collins ""came out"" as bi so this whole thing is so funny to me",en,1650944608665,i never even knew misha collins came out as bi so this whole thing is so funny to me,never even know misha collins come bi whole thing funny
3986,Tue Apr 26 04:18:22 +0000 2022,"@AnCaldazar honestly love being just supernatural-adjacent enough that I get the jokes, because 24 hours of bisexual misha collins is extremely on brand for the whole fandom",en,1650946702660, honestly love being just supernatural adjacent enough that i get the jokes because 24 hours of bisexual misha collins is extremely on brand for the whole fandom,honestly love supernatural adjacent enough get joke 24 hours bisexual misha collins extremely brand whole fandom
3988,Tue Apr 26 04:23:05 +0000 2022,"@mishacollins You deserve a hug. We all make mistakes, Misha. Don't worry. https://t.co/TARQafqxHn",en,1650946985657, you deserve a hug we all make mistakes misha don t worry ,deserve hug make mistake misha worry
3989,Tue Apr 26 04:27:51 +0000 2022,@mishacollins Everyone on earth unless you are under 1 has tripped up when speaking. You do a lot more of it in front of audiences than most of us. Give yourself some grace.,en,1650947271664, everyone on earth unless you are under 1 has tripped up when speaking you do a lot more of it in front of audiences than most of us give yourself some grace ,everyone earth unless 1 trip speak lot front audiences us give grace
3992,Tue Apr 26 04:35:09 +0000 2022,"when i began my research on misha collins and supernatural i'd hedge a lot, like - the concept of straightness hadn't been invented, the vocabulary didn't exist, who's to say - but standing on the other side of two years of archival research... misha collins is straight. period.",en,1650947709664,when i began my research on misha collins and supernatural i d hedge a lot like the concept of straightness hadn t been invented the vocabulary didn t exist who s to say but standing on the other side of two years of archival research misha collins is straight period ,begin research misha collins supernatural hedge lot like concept straightness invent vocabulary exist say stand side two years archival research misha collins straight period
3997,Tue Apr 26 04:40:18 +0000 2022,tumblr had me thinking misha collins was gay for the last decade,en,1650948018658,tumblr had me thinking misha collins was gay for the last decade,tumblr think misha collins gay last decade
4004,Tue Apr 26 05:05:48 +0000 2022,Video of Why People Think Supernatural Misha Collins Came Out as Bisexual – JUST WIKI https://t.co/tO84dqhAUH,en,1650949548664,video of why people think supernatural misha collins came out as bisexual just wiki ,video people think supernatural misha collins come bisexual wiki
4009,Tue Apr 26 05:12:06 +0000 2022,@mishacollins I think it's okay to misspeak exactly when one is in a stressful situation like standing in front of people. it happens. Sometimes even big things. Don't think anyone has the right to be mad in this situation. Thank you for addressing it. Love you! Stay safe. ❤,en,1650949926665, i think it s okay to misspeak exactly when one is in a stressful situation like standing in front of people it happens sometimes even big things don t think anyone has the right to be mad in this situation thank you for addressing it love you stay safe ,think okay misspeak exactly one stressful situation like stand front people happen sometimes even big things think anyone right mad situation thank address love stay safe
4011,Tue Apr 26 05:20:51 +0000 2022,"@mishacollins We love you Misha, sending love ❤❤❤ you are the Best angel #CastielForever #Supernatural #SPNFamily 😇😇😇 https://t.co/zijrBlrLfK",en,1650950451661, we love you misha sending love you are the best angel ,love misha send love best angel
4013,Tue Apr 26 05:27:27 +0000 2022,okay im going to sleep now. last word of the night is that my friends just told me i should cancel misha collins for stealing women's accomplishments. wont elaborate. goodnight,en,1650950847657,okay im going to sleep now last word of the night is that my friends just told me i should cancel misha collins for stealing women s accomplishments wont elaborate goodnight,okay im go sleep last word night friends tell cancel misha collins steal women accomplishments wont elaborate goodnight
4017,Tue Apr 26 05:38:26 +0000 2022,texting my best friend like babe please reply to my messages misha collins came out as bi and then came out as straight we have to talk about this. also i have surgery tomorrow so it would be nice maybe,en,1650951506662,texting my best friend like babe please reply to my messages misha collins came out as bi and then came out as straight we have to talk about this also i have surgery tomorrow so it would be nice maybe,texting best friend like babe please reply message misha collins come bi come straight talk also surgery tomorrow would nice maybe
4020,Tue Apr 26 05:50:54 +0000 2022,more like misha collins,en,1650952254659,more like misha collins,like misha collins
4025,Tue Apr 26 06:11:41 +0000 2022,"when you think about it, misha collins and mac always sunny have a lot in common these days",en,1650953501663,when you think about it misha collins and mac always sunny have a lot in common these days,think misha collins mac always sunny lot common days
4028,Tue Apr 26 06:34:39 +0000 2022,"@KittySerenity @mishacollins Yep. One of my favorite things about being bi (this aspect isn't as useful now, but it was when I was single &amp; spry) was the range of options for tension release.

Many of the folks in his replies need to go avail themselves of their vast, God-given sexual options &amp; chill TF out.",en,1650954879664, yep one of my favorite things about being bi this aspect isn t as useful now but it was when i was single amp spry was the range of options for tension release many of the folks in his replies need to go avail themselves of their vast god given sexual options amp chill tf out ,yep one favorite things bi aspect useful single amp spry range options tension release many folks reply need go avail vast god give sexual options amp chill tf
4032,Tue Apr 26 07:01:01 +0000 2022,@ChurchOfGame @mishacollins Thanks for sharing your opinion,en,1650956461665, thanks for sharing your opinion,thank share opinion
4034,Tue Apr 26 07:13:46 +0000 2022,@mishacollins Blocking you due to your use of pronouns. I don't allow that on my Twitter feed.,en,1650957226666, blocking you due to your use of pronouns i don t allow that on my twitter feed ,block due use pronouns allow twitter fee
4035,Tue Apr 26 07:14:17 +0000 2022,"@UndesirableRay @mishacollins The pressure people on the internet put on actors/celebs/influencers/etc. to define their sexuality, especially ones who have characters who are suspected to be LGBTQ is immense. No one should be forced to talk about their sexuality.",en,1650957257664, the pressure people on the internet put on actors celebs influencers etc to define their sexuality especially ones who have characters who are suspected to be lgbtq is immense no one should be forced to talk about their sexuality ,pressure people internet put actors celebs influencers etc define sexuality especially ones character suspect lgbtq immense one force talk sexuality
4040,Tue Apr 26 07:29:28 +0000 2022,"@vicspeach @marsgirl298 @mishacollins 100%!! i'm not like ""we should cancel him for that"", but i can't say i'm not pissed.",en,1650958168665, 100 i m not like we should cancel him for that but i can t say i m not pissed ,100 like cancel say piss
4049,Tue Apr 26 08:24:09 +0000 2022,"@FIREFLYCASTIEL @mishacollins @mishacollins I sat for five minutes trying to come up with a way to phrase how and what you mean to me but it's too much, I can't express it in words. Just, thank you, for being and existing and staying with us. Love you!",en,1650961449659, i sat for five minutes trying to come up with a way to phrase how and what you mean to me but it s too much i can t express it in words just thank you for being and existing and staying with us love you ,sit five minutes try come way phrase mean much express word thank exist stay us love
4051,Tue Apr 26 08:28:41 +0000 2022,"I know exactly 0 things about Misha Collins (except the Mishapocalypse I guess) but this reads as a big damage control move. What I mean is...it feels as if he came out as bi, IS bi, and some manager or other wants to make him retract it before it causes trouble for his career?",en,1650961721660,i know exactly 0 things about misha collins except the mishapocalypse i guess but this reads as a big damage control move what i mean is it feels as if he came out as bi is bi and some manager or other wants to make him retract it before it causes trouble for his career ,know exactly 0 things misha collins except mishapocalypse guess read big damage control move mean feel come bi bi manager want make retract cause trouble career
4073,Tue Apr 26 10:24:15 +0000 2022,"@hamboni5 @RikkisRealm @lemonlimewedge @idrctmlol @mishacollins And that you’re some kind of authority on how others should “properly” react and feel, based entirely on your standards.",en,1650968655665, and that you re some kind of authority on how others should properly react and feel based entirely on your standards ,kind authority others properly react feel base entirely standards
4075,Tue Apr 26 10:25:21 +0000 2022,"@mishacollins 1) Thank you for your statement. I like it 🙂. I am also both: an introverted,sometimes an extroverted person.

I understand that when you're a public person, it's hard when people misunderstand something you say.",en,1650968721657, 1 thank you for your statement i like it i am also both an introverted sometimes an extroverted person i understand that when you re a public person it s hard when people misunderstand something you say ,1 thank statement like also introvert sometimes extroverted person understand public person hard people misunderstand something say
4088,Tue Apr 26 10:59:45 +0000 2022,@mishacollins if you’re not gay you don’t get to make gay jokes. not very ally of you to take the spotlight from actual LGBT people,en,1650970785665, if you re not gay you don t get to make gay jokes not very ally of you to take the spotlight from actual lgbt people,gay get make gay joke ally take spotlight actual lgbt people
4090,Tue Apr 26 11:08:07 +0000 2022,I have absolutely no clue who misha collins is but i am living for the drama!,en,1650971287661,i have absolutely no clue who misha collins is but i am living for the drama ,absolutely clue misha collins live drama
4093,Tue Apr 26 11:11:25 +0000 2022,misha collins is such a fierce ally he decided to be the first person to have to come out as straight,en,1650971485666,misha collins is such a fierce ally he decided to be the first person to have to come out as straight,misha collins fierce ally decide first person come straight
4097,Tue Apr 26 11:26:54 +0000 2022,"'I happen to be straight': Actor Misha Collins apologizes for 'misspeaking' about coming out as bisexual
https://t.co/fwM8FUbMkP",en,1650972414665, i happen to be straight actor misha collins apologizes for misspeaking about coming out as bisexual ,happen straight actor misha collins apologize misspeak come bisexual
4104,Tue Apr 26 11:46:51 +0000 2022,"@mishacollins Misha we love you 
Y'all #LEAVEMISHAALONE",en,1650973611658, misha we love you y all ,misha love
4108,Tue Apr 26 11:55:18 +0000 2022,@mishacollins You’re a mensch and I adore you. 💜,en,1650974118666, you re a mensch and i adore you ,mensch adore
4109,Tue Apr 26 11:55:25 +0000 2022,@Philsoccer3 @AliceInFlannel @miashadow7606 @mishacollins This is real uncalled for though man.,en,1650974125664, this is real uncalled for though man ,real uncalled though man
4110,Tue Apr 26 11:58:14 +0000 2022,"If you want to start spreading rumors, try googling first. It's not that hard. Victoria Vantoch has never mentioned all the personalities in her books. NEVER. Not even Misha Collins. She only mentioned that Misha was such a supportive partner.

🖇️: https://t.co/wtnqYIsQoz https://t.co/GN1kyI0bMq",en,1650974294665,if you want to start spreading rumors try googling first it s not that hard victoria vantoch has never mentioned all the personalities in her books never not even misha collins she only mentioned that misha was such a supportive partner ,want start spread rumor try google first hard victoria vantoch never mention personalities book never even misha collins mention misha supportive partner
4113,Tue Apr 26 12:05:41 +0000 2022,"After 12 years, castiel comes out and then over a year later, misha collins who plays him comes out as straight YOU CAN NOT MAKE THIS SHIT UP https://t.co/d8Iseiy791",en,1650974741666,after 12 years castiel comes out and then over a year later misha collins who plays him comes out as straight you can not make this shit up ,12 years castiel come year later misha collins play come straight make shit
4121,Tue Apr 26 12:52:24 +0000 2022,misha collins the firciest LGBTQIA+ ally,en,1650977544666,misha collins the firciest lgbtqia ally,misha collins firciest lgbtqia ally
4124,Tue Apr 26 12:53:42 +0000 2022,@mishacollins Just proves even more that you are human. Like all of us we ALL have a tendency to jumble what we are trying to say. Keep being the huMAN you are Misha.,en,1650977622657, just proves even more that you are human like all of us we all have a tendency to jumble what we are trying to say keep being the human you are misha ,prove even human like us tendency jumble try say keep human misha
4131,Tue Apr 26 13:01:50 +0000 2022,@The_Ada_Rhodes Anyone got a super high res pic of Misha Collins? 😁,en,1650978110660, anyone got a super high res pic of misha collins ,anyone get super high res pic misha collins
4136,Tue Apr 26 13:15:36 +0000 2022,"#DinsDay Ivermectin China Miyamoto Chris Pratt Pocahontas Sana Weverse misha collins El Muerto 
Age Is Just a Number suga Jupiter Morbius Spider-Man 
Dr. Malone #ConfessionsOfAMermaid #thicktrunktuesday Have a Great Day minhyuk #MVเจ้าอารมณ์ https://t.co/AMuCmGHsAl",en,1650978936662, ivermectin china miyamoto chris pratt pocahontas sana weverse misha collins el muerto age is just a number suga jupiter morbius spider man dr malone have a great day minhyuk ,ivermectin china miyamoto chris pratt pocahontas sana weverse misha collins el muerto age number suga jupiter morbius spider man dr malone great day minhyuk
4146,Tue Apr 26 13:35:58 +0000 2022,Misha Collins: I’m straight and I’m proud! https://t.co/mDB97q0jU6,en,1650980158660,misha collins i m straight and i m proud ,misha collins straight proud
4150,Tue Apr 26 13:46:55 +0000 2022,"@roadfood_diary I totally agree with you Misha Collins didn't do anything wrong, if people Stop to think and have a little empathy with him would be good he is a great and strong ally of the of the lgbtq+ community and because of a mere mistake people forget everything he has ever done",en,1650980815657, i totally agree with you misha collins didn t do anything wrong if people stop to think and have a little empathy with him would be good he is a great and strong ally of the of the lgbtq community and because of a mere mistake people forget everything he has ever done,totally agree misha collins anything wrong people stop think little empathy would good great strong ally lgbtq community mere mistake people forget everything ever do
4151,Tue Apr 26 13:47:23 +0000 2022,supernatural rly is the gift that keeps on giving. 'misha collins comes out as bi and then a day later corrects himself n apologizes n says he's straight and sick to his stomach' is fucking comedy gold,en,1650980843659,supernatural rly is the gift that keeps on giving misha collins comes out as bi and then a day later corrects himself n apologizes n says he s straight and sick to his stomach is fucking comedy gold,supernatural rly gift keep give misha collins come bi day later correct n apologize n say straight sick stomach fuck comedy gold
4152,Tue Apr 26 13:48:27 +0000 2022,@mishacollins That’s very cool,en,1650980907663, that s very cool,cool
4153,Tue Apr 26 13:48:40 +0000 2022,@tumblr @mishacollins naur not under a misha tweet why do all of my fandoms always come full circle,en,1650980920664, naur not under a misha tweet why do all of my fandoms always come full circle,naur misha tweet fandoms always come full circle
4157,Tue Apr 26 13:55:18 +0000 2022,"@mishacollins Thank you, Misha. ❤️",en,1650981318660, thank you misha ,thank misha
4166,Tue Apr 26 14:20:02 +0000 2022,"@corasundae @madeofboredomm @mishacollins That's the impression I got as well, though I didn't see any footage to confirm. It's sad that people love to hate so much, especially on someone who seems to try his best to be an ally, He's human, not perfect...",en,1650982802663, that s the impression i got as well though i didn t see any footage to confirm it s sad that people love to hate so much especially on someone who seems to try his best to be an ally he s human not perfect ,impression get well though see footage confirm sad people love hate much especially someone seem try best ally human perfect
4167,Tue Apr 26 14:21:21 +0000 2022,Misha Collins coming out as straight + Taika reinventing the pride flag within the same day? Emotional whiplash for the queer community.,en,1650982881664,misha collins coming out as straight taika reinventing the pride flag within the same day emotional whiplash for the queer community ,misha collins come straight taika reinvent pride flag within day emotional whiplash queer community
4189,Tue Apr 26 15:10:11 +0000 2022,"I love @mishacollins i am still hurting from what he did and said this weeknd, yes i am mad at him like we all should be yes he apologised hes taken accountability now i hope he lives up to this, learn and growns from this it will take time for me and rest of us to heal!! #LGBTQ https://t.co/HrYChVoCxb",en,1650985811665,i love i am still hurting from what he did and said this weeknd yes i am mad at him like we all should be yes he apologised hes taken accountability now i hope he lives up to this learn and growns from this it will take time for me and rest of us to heal ,love still hurt say weeknd yes mad like yes apologise hes take accountability hope live learn growns take time rest us heal
4195,Tue Apr 26 15:31:03 +0000 2022,"@sunkissed_dream @mishacollins This. The ball handler jokes, the queerbaiting, the rainbow pics, what's it all for? And note that he waited until after the con to correct what he said.",en,1650987063662, this the ball handler jokes the queerbaiting the rainbow pics what s it all for and note that he waited until after the con to correct what he said ,ball handler joke queerbaiting rainbow pics note wait con correct say
4199,Tue Apr 26 15:41:25 +0000 2022,@mishacollins This is so weird cuz I spent my entire life thinking you were gay,en,1650987685664, this is so weird cuz i spent my entire life thinking you were gay,weird cuz spend entire life think gay
4209,Tue Apr 26 16:12:28 +0000 2022,#e_RadioUS ‘Supernatural’ star Misha Collins walks back bold ‘bisexual’ declaration https://t.co/E94tDAaLS9,en,1650989548662, radious supernatural star misha collins walks back bold bisexual declaration ,radious supernatural star misha collins walk back bold bisexual declaration
4229,Tue Apr 26 17:12:48 +0000 2022,"@jaistiel @mishacollins Are u so hypocrite that you wanna blame for how the audience YOU catered to might have reacted? THIS is ur audience. 170 people happy Jared was in a car accident. U have nothing but toxicity to spread and when it backfires - or so you say - you wanna put it on me?!
Fkn precious. https://t.co/eGwKsGhxOE",en,1650993168664, are u so hypocrite that you wanna blame for how the audience you catered to might have reacted this is ur audience 170 people happy jared was in a car accident u have nothing but toxicity to spread and when it backfires or so you say you wanna put it on me fkn precious ,u hypocrite wanna blame audience cater might react ur audience 170 people happy jar car accident u nothing toxicity spread backfire say wanna put fkn precious
4233,Tue Apr 26 17:20:24 +0000 2022,who is misha collins,en,1650993624658,who is misha collins,misha collins
4250,Tue Apr 26 17:57:08 +0000 2022,Somehow this is Misha Collins fault,en,1650995828657,somehow this is misha collins fault,somehow misha collins fault
4260,Tue Apr 26 18:19:56 +0000 2022,"Misha Collins(D) clarifies he's not actually that 'Gay' but was just virtue signalling...  so quit calling guys.

https://t.co/P3fLysC6qf",en,1650997196660,misha collins d clarifies he s not actually that gay but was just virtue signalling so quit calling guys ,misha collins clarify actually gay virtue signal quit call guy
4267,Tue Apr 26 18:31:48 +0000 2022,@mishacollins and @JensenAckles....thank you for speaking up about being diagnosed with ADHD on Sunday.,en,1650997908665, and thank you for speaking up about being diagnosed with adhd on sunday ,thank speak diagnose adhd sunday
4270,Tue Apr 26 18:36:19 +0000 2022,@akaHarriet Your brain is trying to Misha Collins you,en,1650998179666, your brain is trying to misha collins you,brain try misha collins
4273,Tue Apr 26 18:49:50 +0000 2022,can’t believe misha collins overshadowed jameela jamil quitting twitter,en,1650998990662,can t believe misha collins overshadowed jameela jamil quitting twitter,believe misha collins overshadow jameela jamil quit twitter
4298,Tue Apr 26 19:37:18 +0000 2022,@Renkirtley @MysticRhythms87 @mishacollins That last line summed it up perfectly I feel,en,1651001838662, that last line summed it up perfectly i feel,last line sum perfectly feel
4303,Tue Apr 26 19:51:38 +0000 2022,i can't wait for sarah z to make a video about misha collins queerbaiting everyone into think he's bi,en,1651002698663,i can t wait for sarah z to make a video about misha collins queerbaiting everyone into think he s bi,wait sarah z make video misha collins queerbaiting everyone think bi
